{"schema_version":"pr-marker-plan.v1","kind":"pr_marker_plan","feature_id":"doc-002-unified-landing-page-and-ia-shell","status":"planned","source_fingerprint":{"feature_spec_sha":"52b92d5b8aca59beffabcc554faaa26f4f75b8ab602ce6089c01224851e7742e","plan_declared_scope_sha":"ebbc7e16d582774e76238019079aeb196897587b5959d18c6e0210a393b902db","tasks_sha":"274eed821158db9bc2993df17065716e73e876cc2616da90771d17544bcf0f70","reviewability_sha":"9e796257876ecff79499d83d056b9da60d99c6ee4abd3807f7dec485fdbafa07","hazard_route_sha":"eec73c2bdac981364156eb6dd639b8ae51fca09705b69b0c000939ea00142d89"},"markers":[{"id":"foundation","review_order":1,"kind":"foundation","parent_marker_id":null,"source_boundary":{"section":"Foundation","story_id":null,"start_task_id":"T001","end_task_id":"T007"},"task_ids":["T001","T002","T003","T004","T005","T006","T007"],"folded_polish_task_ids":[],"folded_polish_target_reason":"","declared_files":[{"operation":"MODIFIED","path":"docs-site/astro.config.mjs"},{"operation":"MODIFIED","path":"docs-site/package.json"},{"operation":"MODIFIED","path":"docs-site/src/content.config.ts"},{"operation":"MODIFIED","path":"docs-site/tsconfig.json"},{"operation":"MODIFIED","path":"specs/doc-002-unified-landing-page-and-ia-shell/contracts/route-shell-manifest.json"},{"operation":"MODIFIED","path":"specs/doc-002-unified-landing-page-and-ia-shell/plan.md"},{"operation":"MODIFIED","path":"specs/doc-002-unified-landing-page-and-ia-shell/research.md"}],"declared_tests":[],"reviewability":{"status":"block","mode":"tasks","scope":"foundation","evidence_path":"specs/doc-002-unified-landing-page-and-ia-shell/.process/reviewability/tasks-gate.json"},"hazards":["change-shape:modify-heavy"],"subdivision":{"status":"none","details":{}},"implementation_checkpoint":{"status":"pending"},"emission_mapping":{"status":"pending"},"warnings":[]},{"id":"us1","review_order":2,"kind":"user_story","parent_marker_id":null,"source_boundary":{"section":"User Story 1 - Landing Page And Platform Choice","story_id":1,"start_task_id":"T008","end_task_id":"T012"},"task_ids":["T008","T009","T010","T011","T012"],"folded_polish_task_ids":[],"folded_polish_target_reason":"","declared_files":[{"operation":"MODIFIED","path":"docs-site/src/content/docs/index.mdx"},{"operation":"MODIFIED","path":"specs/doc-002-unified-landing-page-and-ia-shell/contracts/route-shell-manifest.json"},{"operation":"MODIFIED","path":"specs/doc-002-unified-landing-page-and-ia-shell/spec.md"}],"declared_tests":[],"reviewability":{"status":"block","mode":"tasks","scope":"us1","evidence_path":"specs/doc-002-unified-landing-page-and-ia-shell/.process/reviewability/tasks-gate.json"},"hazards":["change-shape:modify-heavy"],"subdivision":{"status":"none","details":{}},"implementation_checkpoint":{"status":"pending"},"emission_mapping":{"status":"pending"},"warnings":[]},{"id":"us2","review_order":3,"kind":"user_story","parent_marker_id":null,"source_boundary":{"section":"User Story 2 - Eleven Route Shells And Diataxis Navigation","story_id":2,"start_task_id":"T013","end_task_id":"T026"},"task_ids":["T013","T014","T015","T016","T017","T018","T019","T020","T021","T022","T023","T024","T025","T026"],"folded_polish_task_ids":[],"folded_polish_target_reason":"","declared_files":[{"operation":"MODIFIED","path":"docs-site/astro.config.mjs"},{"operation":"MODIFIED","path":"docs-site/src/content/docs/choose-your-path.md"},{"operation":"MODIFIED","path":"docs-site/src/content/docs/contribute-and-release.md"},{"operation":"MODIFIED","path":"docs-site/src/content/docs/first-run.md"},{"operation":"MODIFIED","path":"docs-site/src/content/docs/glossary.md"},{"operation":"MODIFIED","path":"docs-site/src/content/docs/index.mdx"},{"operation":"MODIFIED","path":"docs-site/src/content/docs/install/claude-code.md"},{"operation":"MODIFIED","path":"docs-site/src/content/docs/install/codex.md"},{"operation":"MODIFIED","path":"docs-site/src/content/docs/reference.md"},{"operation":"MODIFIED","path":"docs-site/src/content/docs/security-and-trust.md"},{"operation":"MODIFIED","path":"docs-site/src/content/docs/spec-kit-lifecycle.md"},{"operation":"MODIFIED","path":"docs-site/src/content/docs/troubleshooting.md"},{"operation":"MODIFIED","path":"specs/doc-002-unified-landing-page-and-ia-shell/contracts/route-shell-manifest.json"}],"declared_tests":[],"reviewability":{"status":"block","mode":"tasks","scope":"us2","evidence_path":"specs/doc-002-unified-landing-page-and-ia-shell/.process/reviewability/tasks-gate.json"},"hazards":["change-shape:modify-heavy"],"subdivision":{"status":"none","details":{}},"implementation_checkpoint":{"status":"pending"},"emission_mapping":{"status":"pending"},"warnings":[]},{"id":"us3","review_order":4,"kind":"user_story","parent_marker_id":null,"source_boundary":{"section":"User Story 3 - Build, Links, Pages Config, And Quickstart","story_id":3,"start_task_id":"T027","end_task_id":"T036"},"task_ids":["T027","T028","T029","T030","T031","T032","T033","T034","T035","T036"],"folded_polish_task_ids":["T037","T038","T039","T040","T041","T042","T043"],"folded_polish_target_reason":"nearest_preceding_non_polish_scope","declared_files":[{"operation":"MODIFIED","path":"docs-site/astro.config.mjs"},{"operation":"MODIFIED","path":"docs-site/package.json"},{"operation":"MODIFIED","path":"docs-site/pnpm-lock.yaml"},{"operation":"MODIFIED","path":"docs-site/src/content/docs/index.mdx"},{"operation":"MODIFIED","path":"docs-site/src/content/docs/reference.md"},{"operation":"MODIFIED","path":"specs/doc-002-unified-landing-page-and-ia-shell/contracts/route-shell-manifest.json"},{"operation":"MODIFIED","path":"specs/doc-002-unified-landing-page-and-ia-shell/quickstart.md"}],"declared_tests":[],"reviewability":{"status":"block","mode":"tasks","scope":"us3","evidence_path":"specs/doc-002-unified-landing-page-and-ia-shell/.process/reviewability/tasks-gate.json"},"hazards":["change-shape:modify-heavy"],"subdivision":{"status":"none","details":{}},"implementation_checkpoint":{"status":"pending"},"emission_mapping":{"status":"pending"},"warnings":[]}],"warnings":[{"code":"reviewability_size_warning","severity":"warning","message":"Reviewability sizing result is marker-planning input.","source":"reviewability","details":{"status":"block","mode":"tasks","evidence_path":"specs/doc-002-unified-landing-page-and-ia-shell/.process/reviewability/tasks-gate.json"}}]}
