{"schema_version":"pr-marker-plan.v1","kind":"pr_marker_plan","feature_id":"tacd-001-platform-mechanics-spike","status":"planned","source_fingerprint":{"feature_spec_sha":"60095a4164a9dbeb31976dbae7b74b8779a564b56cda3719da1b4b4d054c5bf0","plan_declared_scope_sha":"0edd38b6b7ddea5f87d8bc5a71e1a4ad92d0353725daf730426c5f7ce8537dc9","tasks_sha":"e2e9d53c76c6e1766517dd1463ba689b8f6de861957f040c08b59f005bdd852f","reviewability_sha":"8b26507768f4e74b3b3918e313e72afbb13b402704f6f1d7230d8c704e1915a0","hazard_route_sha":"5ec383c17e5e7102cc97e81882f023da85a301abb73f39023ddea31b24e349f0"},"markers":[{"id":"foundation","review_order":1,"kind":"foundation","parent_marker_id":null,"source_boundary":{"section":"Foundation","story_id":null,"start_task_id":"T001","end_task_id":"T005"},"task_ids":["T001","T002","T003","T004","T005"],"folded_polish_task_ids":[],"folded_polish_target_reason":"","declared_files":[{"operation":"MODIFIED","path":"docs/ai/research/tool-agnostic-capability-discovery-spike.md"},{"operation":"MODIFIED","path":"specs/tacd-001-platform-mechanics-spike/plan.md"},{"operation":"MODIFIED","path":"specs/tacd-001-platform-mechanics-spike/spec.md"}],"declared_tests":[],"reviewability":{"status":"block","mode":"tasks","scope":"foundation","evidence_path":"specs/tacd-001-platform-mechanics-spike/.process/marker-plan/reviewability-task-gate.json"},"hazards":["change-shape:modify-heavy"],"subdivision":{"status":"none","details":{}},"implementation_checkpoint":{"status":"pending"},"emission_mapping":{"status":"pending"},"warnings":[]},{"id":"us1","review_order":2,"kind":"user_story","parent_marker_id":null,"source_boundary":{"section":"User Story 1 - Runtime-Surface Audit and Mechanics Evidence","story_id":1,"start_task_id":"T006","end_task_id":"T015"},"task_ids":["T006","T007","T008","T009","T010","T011","T012","T013","T014","T015"],"folded_polish_task_ids":[],"folded_polish_target_reason":"","declared_files":[{"operation":"MODIFIED","path":"docs/ai/research/tool-agnostic-capability-discovery-spike.md"}],"declared_tests":[],"reviewability":{"status":"block","mode":"tasks","scope":"us1","evidence_path":"specs/tacd-001-platform-mechanics-spike/.process/marker-plan/reviewability-task-gate.json"},"hazards":["change-shape:modify-heavy"],"subdivision":{"status":"none","details":{}},"implementation_checkpoint":{"status":"pending"},"emission_mapping":{"status":"pending"},"warnings":[]},{"id":"us3","review_order":3,"kind":"user_story","parent_marker_id":null,"source_boundary":{"section":"User Story 3 - Active-vs-Historical Allowlist Recommendation","story_id":3,"start_task_id":"T016","end_task_id":"T019"},"task_ids":["T016","T017","T018","T019"],"folded_polish_task_ids":[],"folded_polish_target_reason":"","declared_files":[{"operation":"MODIFIED","path":"docs/ai/research/tool-agnostic-capability-discovery-spike.md"}],"declared_tests":[],"reviewability":{"status":"block","mode":"tasks","scope":"us3","evidence_path":"specs/tacd-001-platform-mechanics-spike/.process/marker-plan/reviewability-task-gate.json"},"hazards":["change-shape:modify-heavy"],"subdivision":{"status":"none","details":{}},"implementation_checkpoint":{"status":"pending"},"emission_mapping":{"status":"pending"},"warnings":[]},{"id":"us2","review_order":4,"kind":"user_story","parent_marker_id":null,"source_boundary":{"section":"User Story 2 - Directive-Home Recommendation and TACD-002/TACD-003/TACD-004 Handoff","story_id":2,"start_task_id":"T020","end_task_id":"T024"},"task_ids":["T020","T021","T022","T023","T024"],"folded_polish_task_ids":["T025","T026","T027","T028","T029","T030"],"folded_polish_target_reason":"nearest_preceding_non_polish_scope","declared_files":[{"operation":"MODIFIED","path":"docs/ai/research/tool-agnostic-capability-discovery-spike.md"},{"operation":"MODIFIED","path":"specs/tacd-001-platform-mechanics-spike/quickstart.md"}],"declared_tests":[],"reviewability":{"status":"block","mode":"tasks","scope":"us2","evidence_path":"specs/tacd-001-platform-mechanics-spike/.process/marker-plan/reviewability-task-gate.json"},"hazards":["change-shape:modify-heavy"],"subdivision":{"status":"none","details":{}},"implementation_checkpoint":{"status":"pending"},"emission_mapping":{"status":"pending"},"warnings":[]}],"warnings":[{"code":"reviewability_size_warning","severity":"warning","message":"Reviewability sizing result is marker-planning input.","source":"reviewability","details":{"status":"block","mode":"tasks","evidence_path":"specs/tacd-001-platform-mechanics-spike/.process/marker-plan/reviewability-task-gate.json"}}]}
